Asin,UserName,Rating,Subject,ReviewDate,Review
B0863D4XJW,Gandalf,5.0 out of 5 stars,Perfect,"Reviewed in the United States on March 28, 2020","In my opinion, the 2020 MacBook Air is a perfect laptop. It has physical keys that are a pleasure to type on, a beautiful screen, an optimal size, good pricing, and a quad-core processor. The only ""touch"" button is the fingerprint sensor and the touch pad. The onboard graphics are as good as discrete graphics from a few years ago according to benchmarks, which is impressive. The speakers work well. Being an educator, I purchased it on the Apple Education Store for $1200, and it couldn't have come at a better time, given the transition to Zoom in the coronavirus pandemic. Thank you, Apple, for rediscovering yourself. I had been holding onto my 2012 MacBook Pro because I was unimpressed with the offerings the past few years.You shouldn't get this if you are looking for onboard power, but if you are, you probably didn't need me to tell you that. Otherwise, get it. It's great.Update: After reviewing benchmarks and reviews, I believe the upgrades you should consider, in order of priority are:1. i3 -> i52. 8gb -> 16gbThe i5 -> i7 is a small boost in power per Geekbench scores, but again, this isn't supposed to be used for heavy computing due to cooling limitations, so this is a novelty in my opinion. Additionally, the storage upgrades (up to 2 TB) are hard to justify when you have EXTREMELY FAST 40 GBP/s thunderbolt 3 ports that can easily be used for an external SSD that is more or less as fast as the built-in SSD. Unlike the other upgrades, which are set in stone once you purchase the computer, the memory can be increased with external hard drives with little to no compromise. This upgrade is a novelty as well, in my opinion.Update 2: The computer works well in most situations. Because of some laggy moments while running a lot of programs, I will be returning the default configuration I ordered and getting a customized i5 or i7 and 16gb ram. During Zoom screen sharing (and while many other programs run), sometimes the fan will whir (it's supposed to), but I installed a CPU temperature app and it appears to regulate temperature successfully. I haven't tempered my praise for this machine, because it's not supposed to be a performance workhorse."
B0863D4XJW,Rosella Serinelli,2.0 out of 5 stars,Camera has very bad performances,"Reviewed in the United States on April 1, 2020","It has been widely reported that the camera on the 2020 MacBook Air is low quality, but mine was definitely in the non-acceptable range. Picture was very grainy, unfocused, and low light level. I strongly suspect the glass in front of the video chip was damaged, perhaps for a contamination during assembly, but have now way of checking directly. Cleaning the outside had no effect.With heavy heart, I decided to return the unit, and buy an equivalent from the big-box store, where quality can (and will) be checked before purchasing.Update: refund for the item still pending, 14 working days after the returned item was delivered to Amazon. Worse than expected and worse than advertised (14 calendar days)"
B0863D4XJW,Sanjeev,5.0 out of 5 stars,Better than Last Year's and Original MacBook Air,"Reviewed in the United States on March 29, 2020","The original MacBook Air is retailing for like $749.99 right now. Don't buy that. It looks ugly and it's old. Buy the new refreshed 2020 model. This model is authentic, straight from Apple, and it looks fresh.One downside: Open it in a garage or something. I opened it in my room and my room smells like aluminum. Overall, this is a really good product for day-to-day use."
B0863D4XJW,Maria Christina Enriquez,5.0 out of 5 stars,Heating Problem,"Reviewed in the United States on March 30, 2020",It's so nice but heats so fast.
B0863D4XJW,Orangeman,4.0 out of 5 stars,Nice Computer at an Affordable Price,"Reviewed in the United States on April 1, 2020","For the average or small business person this computer will do more than enough and is a vast improvement over previous models. Catalina OS though sucks, otherwise would have given it a 5 rating. Problem is a lot of software I need for work is limited or won't work with Catalina. Yeah, you can take a chance and transition back to High Sierra or whatever but that's not a task I would want to handle myself personally and in checking with several computer guys in the area its not worth the cost, puts the price right back up to where the MacBook Airs were priced before. Keyboard is heaven, processor is fast enough for the most part, other than Catalina its great. Apple, get your act together, Catalina is not what most people want or need in my opinion."
B0863D4XJW,Delvin Douchebaggery,5.0 out of 5 stars,SUPER ULTRA MEGA AWESOMETOSH,"Reviewed in the United States on March 31, 2020","What an upgrade over the 2017 Macbook air! Retina, magic keyboard, speakers, smaller form factor, finger print something-or-other, etc. When you hold it in your hand(s) it feel like a solid pice of aluminum. Totally pimptastic to the max. Getcha some!"
B0863D4XJW,Ash,1.0 out of 5 stars,Loud fan during FaceTime calls and poor camera,"Reviewed in the United States on May 18, 2020","The camera has a poor image quality (only 720p) and the fan gets very loud during FaceTime/Zoom calls. The MacBook Air 2020, like the MacBook Air 2018 and 2019, has very poor thermal design because there is no pipe to connect the fan to the CPU's heatsink.The MacBook Air 2020 is suitable for causal use. But even a video call will push the CPU's temperature to a 100 degrees celsius. Because of the poor thermal design, the fan becomes loud and the device will thermal throttle (meaning it limits the CPU's speed in order to reduce its temperature). This was not a present problem in MacBook Air devices produced before 2018 as the CPUs in those devices were properly cooled (the fan was connected to the CPU with a pipe).With the 2020 MacBook Air, you get a loud fan and a CPU performance that cannot be sustained for a longer time. The problem becomes even worse when you connect an external monitor to it.The most important advantage that the MacBook Air 2020 has over other Apple laptops is that it is the only one which still has a keyboard with no Touch Bar. So many people dislike the gimmicky Touch Bar in the MacBook Pro, as the Touch Bar ends up getting in your way and slowing you down.This would be a great laptop if it has a proper thermal cooling system and a better camera (at least a 7-megapixel sensor capable of 1080p)."
B0863D4XJW,Desirae Garcia,5.0 out of 5 stars,AS ADVERTISED!,"Reviewed in the United States on March 27, 2020","Great, exact product. perfect and authentic, made in California apple"
B0863D4XJW,Amazon Customer,1.0 out of 5 stars,Do NOT buy this computer from Amazon!,"Reviewed in the United States on May 1, 2020","Amazon does not check this product for manufacturing defects. When my computer arrived the screen has bubbles in it and they are very large ones. For the price of this computer it should be defect free! When I tried to contact Amazon Customer service I get this ""Currently Unavailable."" I am stuck with this expensive computer and it's defects. I cannot return it because I need it for my business. I wanted Amazon to replace it but That option is ""Currently Unavailable"" too. The camera on this computer is grainy and low quality. I'm not sure if that is a defect too or if that is  just the quality of the camera. If you buy this item through Apple they will make sure the product is free from defects although it will cost a bit more. You have to decide that for yourself. I am very disappointed with this product and Amazon for not giving me the support I needed with this product."
B0863D4XJW,Cliente de Amazon,1.0 out of 5 stars,Maybe used.,"Reviewed in the United States on May 25, 2020","I suspect the MacBook Air I received was used. The computer could not found the hard drive, when I tried to use the recovery option, surprise, the computer was locked, possibly by the previous owner. It had fingerprints in the screen and the keyboard. I'm very dissapointed with Anazon, it's the first time I bought a NEW Macbook and instead received something that looks like being used, unusable and locked. Returned immediately."
B0863D4XJW,aisia beamon,5.0 out of 5 stars,Awesome purchase,"Reviewed in the United States on May 7, 2020",I am in love best investment that I have made.  I have been working from home and taking online classes.  Makes it so convent and easy.  Love the sound and feel of the keyboard. Webcam sucks but that’s not why I got it.
B0863D4XJW,Essence W.,1.0 out of 5 stars,Slow - Do Not Buy,"Reviewed in the United States on April 6, 2020",This MacBook Air is extremely slow. Right out the box it was slow and even after updating it is still slow and seems to only be getting slower day by day. Returning. Avoid this rip-ff at all cost.
B0863D4XJW,MC,1.0 out of 5 stars,Please don’t purchase. You’ll be disappointed,"Reviewed in the United States on May 18, 2020","I’m extremely disappointed. As soon as I turned it on the fan was on super loud, it was slow and when I started time machine to begin a new backup it took forever. It was brand new out of the box and it sadly sucks. I’m returning after having it for a day. I had my IT family member  take a look and they could no believe how slow it was. It rebooted on its own twice within the first hour of using it. I’m sadly returning it. I need a computer but this ain’t worth it. Save yourself and find something else. I’m a huge Apple fan but this really is awful."
B0863D4XJW,Chris,1.0 out of 5 stars,DID NOT WORK,"Reviewed in the United States on April 26, 2020","The laptop came in really good packaging and was really nice out of the box. But when I was starting everything up, the screen automatically went black and the fans turned on at a very high level. I called the apple support line but their methods of trying to restart the computer did not work. Very upset on how this turned out!"
B0863D4XJW,J. T. ,5.0 out of 5 stars,Great Laptop if you Pony Up for the Quad Core Processor,"Reviewed in the United States on April 26, 2020","I first bought the lowest-priced MacBook Air which has the lowest capacity SSD of all available. When it showed up at my house, I was surprised at how sluggish it was. I read some reviews, and realized that Apple didn't make it clear (at least to me) that the lowest-priced Air also has a slower, dual core processor. It makes sense in hindsight, but I digress. I returned that Air, and replaced it with the 500+GB SSD and quad core processor. Wow! The difference in performance is marked! Multitasking, turning on from sleep, everything is MUCH quicker and smoother than with the dual core processor. If you can afford the higher-priced model, I really recommend it!Overall, the MacBook Air is really a beautiful machine aesthetically. I the recycled aluminum exterior is slick and high-end. The onboard speaker won't ever be confused for an external sound system, but it is the best onboard speaker system I've heard. The Retina screen looks great; vibrant and detailed. I also love the large touch pad with the gestures.My favorite aspect of the laptop is the OS. Out of the box this runs Catalina. I haven't owned a Mac since the iBook G4, but I got back into it without much exploring required. I like how easily it works with my iPhone XR as well. Getting texts on the laptop, or pushing a webpage on my iPhone to my Air is seamless and easy. Things just work. I needed to download updated drivers so that I could print wirelessly to my Canon laser printer, but that took five minutes. I also downloaded and installed Chrome for Mac, which I use for a few things, but Safari works very well for the sites I visit. I did have to buy a converter cable that switched from the onboard USB-C to a regular USB cable for a few attachments I have, but that was pretty cheap (especially for an Apple product). I wish the Air had one more USB-C port.Some people hate the onboard camera. At first I was disappointed with it too. With all of this COVID business, I use my laptop to play D&D online with friends via Roll20. We use cameras to interact with each other, and although I found the onboard camera to be slightly grainy, it is very fluid. One of my friends commented that everyone else's video feed stuttered as they moved, but mine looked like he was watching TV. So, although it could be better, it is NOT horrible for my purposes. For the price we pay, Apple could beef up the camera, but it is what it is."
B0863D4XJW,Madeline Shirey,5.0 out of 5 stars,Absolutely fantastic purchase. Lightning fast shipping. Couldn't be happier.,"Reviewed in the United States on April 8, 2020","So, between apples new keyboard, and with the government c19 rebate coming, I figured it was time I got a new laptop. I couldn't be happier with it. The machine itself is lighting fast, and the keyboard is just a hair short of orgasmic. The new key switches add the perfect amount of weight to the keys that frankly make it exhilarating to type on. The battery life has been pretty much as advertised, as expected with . No complaints there. My only gripe, if I have one, is the camera on it is kind of garbage. I mean it's functional, and after this pandemic thing is over Ill likely never use it again, so its a small gripe. But still. As far as shipping goes, Amazon didn't fail to deliver. Initially I planned to just buy it from Apple directly, but they were talking about 3 weeks out before it would ship. Checked over here, and, though I couldn't get the upgraded ram chip I wanted, I got the computer in 3 days during a pandemic. Actually two days before it was promised. Well done, Amazon. Another smile delivered."
B0863D4XJW,Matt,4.0 out of 5 stars,It’s a bang for the buck! ...Almost (see edits),"Reviewed in the United States on April 7, 2020","So far it’s been a killer of a laptop! The keyboard is pretty great and it sounds and feels great to type on. I actually want to write with my laptop now. I got the i3 model, and as it doesn’t sound impressive I think it’s the best option for the MacBook Air as this laptop does have overheating issues (hence the 4/5 stars) and as the i3 doesn’t require as much power as an i5 or i7, it doesn’t have as bad of throttling issues. It remains fast enough for my needs as well, it also has enough storage for my 25GB of music, my entire 20GB of google drive and all my apps, and it runs them all pretty fast, including Adobe Lightroom.TLDR: A fast little laptop with great build and aesthetic, improved keyboard, great speakers (for a laptop), and a lower than average MacBook price. But with overheating issues (wait for the next MacBook Pro if you want to avoid the heat issue). 5-StarsEDIT:I am thinking about getting a return because of the heating issue. If I only have a couple apps open and watch YouTube full screen, my cpu/gpu STILL reach nearly 80degrees. Unacceptable. It’s a great laptop, but that reason alone if such a letdown...Save your money for the next MacBook Pro, or get the 2017 MacBook Air, at least that one has a heat pipe connected to the fan. 2-StarsEDIT 2:Ok, so somehow my worries are going down about the heat thing. No matter what I do with it I haven't really noticed any slowdowns or problems. The fans may ramp up at some point, but even so it still cools down relatively quick, so I feel like it is something that I can tolerate as there's nothing else with the laptop I dislike. 4-Stars"
B0863D4XJW,Benjamin W. Decker,1.0 out of 5 stars,Terrible Camera,"Reviewed in the United States on April 15, 2020",I bought this because of the advertised “HD” camera. The camera is garbage. Super disappointed
B0863D4XJW,Talia Cotton LCS,1.0 out of 5 stars,Disappointed,"Reviewed in the United States on April 21, 2020","The computer kept crashing!! It would start up, freeze and restart. I paid too much money for that to happen. I sent it back for a refund. I’m sooooo disappointed!"
B0863D4XJW,Austin Dame,3.0 out of 5 stars,Very Limited Uses,"Reviewed in the United States on June 13, 2020","I'm a computer technician and I'm also an author (ghost writer technically, so nothing is actually published in my name).  As a computer technician I would give this computer a 1/5.  It's a disposable paper bag with a horrible cooling system.  If one minor thing goes wrong with it, it's toast.  Soldered on SSD and RAM, very few modular components, etc.  So why did I buy it?Well, as an author I need a computer with a good keyboard that's lightweight and has a long battery life.  For writing and reading articles online, this computer is great.  If you need to do ANYTHING else however (including watching YouTube videos - which wouldn't be taxing on any other computer), you should choose a different computer.  The cooling system I mentioned?  It's basically non-existent.  The fan isn't connected to the heat sink at all.  This means that if you use the computer for anything taxing at all (YouTube videos, games, photo editing, etc.) it's going to overheat.  This will cause the computer to die in about a year or two, and when it does, the cost for repair is going to be close to $1,000 because of the way Apple designed it.If all you're going to do is browse the internet and type documents then this is an okay computer that should last you 3-5 years.  If you want to do anything else then I recommend a PC.  If you absolutely have to go Mac, then get the MacBook Pro (the new one with the standard keyboard)."
B0863D4XJW,Carolyn,1.0 out of 5 stars,Does not work out of the box,"Reviewed in the United States on April 19, 2020","It boots up, but shuts down and reboots ever five minutes.Brand new out of the box and it will not completely boot up, apple logo shows up on screen then computer shuts down and restarts every few minutes without ever completely booting up. I have returned this item."
B0863D4XJW,Catherine Mae,5.0 out of 5 stars,Absolute powerhouse.,"Reviewed in the United States on April 7, 2020","I’ve used PC since I could remember. I decided to upgrade and I don’t regret it. This laptop is so tiny but an absolute powerhouse of machinery. The speed is impeccable and the overall performance is even better.I can easily run Photoshop, Netflix & Google Chrome with 5+ open tabs and the laptop does NOT heat up or slow down. It stays cool and runs as if the applications weren’t in use at all. I don’t use other apps besides Facebook messenger, which might be the reason why the laptop otherwise has a lot of give.Expensive, but I’m not disappointed. The only CON I can think of is the webcam. Absolute trash. In 2020 there’s no reason why the webcam should be this bad, and for the price we’re paying, we see better quality webcams in PCs today. Apple has no reason not to do better in terms of the camera."
B0863D4XJW,Juana,4.0 out of 5 stars,Very worth getting for price and specs,"Reviewed in the United States on April 6, 2020",The new magic keyboard is amazing when typing. Unlike the 2019 MacBook Air. It’s so amazing how you pay $999 for double the storage you got form last year that’s starts at $1099. It’s is very fast and smooth. The only thing I don’t like is the noisy fan. The reason for this is because the MacBook is trying to run at its full potential for some stuff so from keeping it firm overheating the fan turns on. Besides that you should get it.
B0863D4XJW,JB,2.0 out of 5 stars,Want to feel productive on a daily basis? Avoid the MacBook Air.,"Reviewed in the United States on May 18, 2020","Three weeks in. Mac user since 1994. Badly wishing I purchased another laptop for work.Apple .. not sure what's happened with your products. My last two iPhones have infested with bugginess. Now this MacBook Air.Bought the MacBook Air as a light-weight machine for light work. I am a consultant and this is my work computer. Here's what I use on a daily basis: Two 17W external monitors, a USB external drive, Chrome, Zoom, and Office 365 through web browser.This MacBook Air 2020 cannot handle the above. Can you believe that?If you're in the same boat as me, do not buy this machine. My productivity has tanked. Multiple times a week I have to stop working, pinpoint problem, and hunt and hunt for an easy resolution. Today I am stopping work to write a review. Yet again problems with inadequate resolutions or none at all.Since purchasing 3 weeks ago, I've lost productivity 2-3 times a week (twice I lost over two hours) trying to figure out:1 (and most importantly). Why does the fan run continuously LOUD?Apple resolution: None. Apple doesn't acknowledge the problem let alone a flaw in its design.Researching reviews from other MacBook Air 2020 owners show running Chrome uses up ALL of the MacBook Air's processing power. The processor overheats and on goes the fan. With 5+ tabs open or tabs plus another application open, the fan powers on full force and Chrome often crashes.The MacBook Air owners' resolution? Don't use Chrome. Need or want Chrome? Buy a third party app to decrease processing speed. Need processing speed to work? Umm, well, buy a different computer I guess?I prefer Chrome because clients often use Google products. Chrome's Inspect Element is the best browser tool out there.Interesting part: All of the publication previews and reviews said MacBook Air 2020 could run Chrome with 30 tabs ""without a problem!"" Search the internet for us real MacBook Air 2020 purchasers and users.There are so many other problems in three weeks of use...2. Why bootup is so incredibly slow.Apple resolution: Bootup with a simple 250GB external drive plugged in to a mini dock sucks too much power from Mac. What?3. Why configuring external screens is difficult.Apple resolution: The shell of a Mac positioned directly below a monitor should be kept closed. What?4. Why my mini dock can only power two external monitors (17W consumption per monitor) but not with a simple USB external drive.Apple solution: Buy a separately powered dock.Okay, how much money do I need to spend on buying and trying accessories?In the past a Mac would tell you if an accessory was using too much power. This MacBook Air does not.5. Why after I put the Mac to sleep, the laptop awakes on external screens after I close the shell.Apple resolution: Keep the Mac shell closed always. What?6. Why the dock cannot be locked to one screen.Apple resolution: None.In buying a work laptop, I should have considered all my Apple problems in the last 10-15 years. Should have stuck to my gut and switched to PC."
